"gate_name","gate_type","trigger_event","success_criteria","failure_action","responsible_team","automation_level","tools_used","measurement_frequency","escalation_procedure","historical_pass_rate","average_resolution_time","business_impact"
"Code Commit & Static Analysis Gate","Functional","Pull Request Creation","Zero linting errors (ESLint); Prettier formatting compliant; Commit messages follow Conventional Commits; No hardcoded secrets detected (GitGuardian).","Block Merge","Development Team","Fully Automated","Husky, ESLint, Prettier, commitlint, GitGuardian","Per Commit","Developer remediates immediately; Tech Lead review for false positives.","95","0.5","Prevents technical debt accumulation and credential leakage early in the lifecycle."
"Unit Test Coverage Gate","Coverage","CI Pipeline - Build Stage","Global coverage > 80%; Financial/Payout Orchestration > 100%; Audit Log Service > 95%; Authentication > 95%.","Fail Build","Backend Team","Fully Automated","Jest, Istanbul/NYC","Per Pull Request","Pull Request rejected automatically. Developer must add tests.","85","2","Ensures logic integrity for critical financial and security components, reducing risk of financial loss."
"Vulnerability & Dependency Security Gate","Security","CI Pipeline - Security Stage","Zero Critical or High vulnerabilities in npm packages and Docker images; SAST scan passes OWASP Top 10 checks.","Block Deployment","Security Engineer","Fully Automated","Snyk, Trivy (Container), SonarQube (SAST)","Per Pull Request / Nightly","Security Team review required for waivers on false positives. Critical CVEs require immediate patch.","90","24","Prevents introduction of known vulnerabilities, protecting client data and ensuring compliance (SOC 2)."
"Integration & Contract Test Gate","Functional","CI Pipeline - Integration Stage","100% pass rate for Stripe/Wise contract tests; Payout Saga patterns validate atomic rollback; Postgres pgvector queries execute successfully.","Fail Pipeline","Backend Team","Fully Automated","Supertest, LocalStack, Pact (Contract Testing)","Per Pull Request","Notify Backend Lead. Rollback if detected in main branch.","88","4","Validates that microservices and external payment gateways interact correctly, preventing transaction failures."
"Performance Baseline Gate","Performance","Deployment to Staging","API Response p95 < 250ms; Vector Search < 500ms; SOW Processing throughput > 60s/doc; Bulk Import > 500 records/min.","Warn (Block if degradation > 10%)","DevOps / QA","Fully Automated","k6, AWS CloudWatch, Prometheus","Per Release Candidate","Performance Engineer analysis. Optimization sprint required if degradation persists.","92","48","Ensures system responsiveness and scalability for enterprise workloads, preventing SLA breaches."
"End-to-End (E2E) User Journey Gate","Functional","Deployment to Staging","100% pass rate on Critical paths: 'Vendor Proposal Submission', 'Admin Payout Approval', 'Client Invoice Payment'.","Block Release to Production","QA Team","Fully Automated","Playwright, MailHog (Email verification)","Nightly / Pre-Release","QA Lead investigation. Manual regression test fallback if automation is flaky.","80","8","Guarantees core business value streams function correctly from the user's perspective."
"Compliance & Privacy Gate","Compliance","Pre-Release","PII redaction verified in logs and SOW artifacts; Encryption at rest verified for RDS/S3; Data residency checks pass.","Block Release","Data Privacy Officer / Security","Partially Automated","AWS Macie, Custom PII Scripts, Manual Audit","Per Major Release","Legal/Compliance review. Release halt until compliant.","98","72","Ensures GDPR/CCPA compliance, avoiding legal penalties and reputational damage."
"Post-Deployment Health Gate","Functional","Deployment to Production","Health check endpoints return 200 OK; Error rate < 0.1%; Latency matches baseline; Database connection pool stable.","Auto-Rollback","SRE / DevOps","Fully Automated","ArgoCD, Prometheus, AWS CloudWatch Alarms","Continuous (First 15 mins post-deploy)","On-call Engineer paged. Incident response initiated.","99","0.2","Minimizes downtime and user impact during failed deployments."